{
  "schema_version": "1.0",
  "task_id": "TASK-AGENT-PARSERFIX-001",
  "result": "completed",
  "source_revision": "965702e9db7629174b0a6ccb12414db7372e7c01",
  "started_at": "2026-09-28T20:08:29+07:00",
  "completed_at": "2026-09-28T20:09:34+07:00",
  "changed_files": [
    "services/api/src/campus247/agent/output_parser.py",
    "tests/unit/ai/test_output_parser.py"
  ],
  "preexisting_changes": [],
  "resolved_upstream_traceability": {
    "resolution_mode": "direct",
    "binding_ref": "tasks/requirement-acceptance-bindings.yaml",
    "requirements": [
      {
        "requirement_id": "REQ-NF-SEC-008",
        "acceptance_criteria": ["AC-REQ-NF-SEC-008-01"]
      }
    ]
  },
  "commands": [
    {
      "command": "python -B -m pytest -q tests/unit/ai/test_output_parser.py",
      "working_directory": "C:\\Users\\Duong Vinh\\Vinh",
      "exit_code": 0,
      "result": "passed",
      "evidence_refs": ["focused-tests"]
    },
    {
      "command": "python -B tasks/tools/validate_catalog.py",
      "working_directory": "C:\\Users\\Duong Vinh\\Vinh",
      "exit_code": 0,
      "result": "passed",
      "evidence_refs": ["catalog-validation"]
    }
  ],
  "acceptance_results": [
    {"criterion_id": "AC-TASK-AGENT-PARSERFIX-001-01", "status": "passed", "evidence_refs": ["focused-tests", "scoped-diff"]},
    {"criterion_id": "AC-TASK-AGENT-PARSERFIX-001-02", "status": "passed", "evidence_refs": ["focused-tests"]},
    {"criterion_id": "AC-TASK-AGENT-PARSERFIX-001-99", "status": "passed", "evidence_refs": ["initial-status", "final-status", "scoped-diff"]}
  ],
  "evidence": [
    {"kind": "command", "ref": "focused-tests: 11 passed", "sha256": null},
    {"kind": "command", "ref": "catalog-validation: VALID tasks=241", "sha256": null},
    {"kind": "git", "ref": "initial-status: both scoped files clean; unrelated dirty work preserved", "sha256": null},
    {"kind": "git", "ref": "final-status: only the two scoped files changed by this task", "sha256": null},
    {"kind": "git", "ref": "scoped-diff: parser and tests reviewed", "sha256": null}
  ],
  "diff_summary": "Removed Markdown fence extraction; rejected duplicate keys at every depth, NaN, Infinity and float overflow before schema validation; added focused negative tests.",
  "scope_conformance": {"status": "passed", "unexpected_files": []},
  "deviations": ["The first captured start timestamp followed some preflight work; preexisting_changes lists scoped files only, while full initial Git status was inspected."],
  "residual_risks": ["The focused parser tests do not establish that the full security suite passes."],
  "blocker": null
}
