{
  "schema_version": "1.0",
  "task_id": "TASK-WEB-SCHED-004",
  "result": "completed",
  "source_revision": "965702e9db7629174b0a6ccb12414db7372e7c01",
  "started_at": "2026-09-27T21:31:43+07:00",
  "completed_at": "2026-09-27T21:33:37+07:00",
  "changed_files": [
    "apps/web/src/features/schedule/ScheduleView.tsx",
    "apps/web/src/features/schedule/ScheduleView.test.tsx",
    "apps/web/src/app/schedule/page.tsx"
  ],
  "preexisting_changes": [
    "apps/web/e2e/grounded-faq.spec.ts",
    "apps/web/e2e/handover.spec.ts",
    "apps/web/src/app/chat/page.tsx",
    "apps/web/src/app/globals.css",
    "apps/web/src/app/layout.tsx",
    "apps/web/src/app/page.test.tsx",
    "apps/web/src/app/page.tsx",
    "apps/web/src/app/rooms/page.tsx",
    "apps/web/src/app/staff/page.tsx",
    "apps/web/src/app/tickets/page.tsx",
    "apps/web/src/components/AppShell.tsx",
    "apps/web/src/components/AsyncState.test.tsx",
    "apps/web/src/components/AsyncState.tsx",
    "apps/web/src/features/chat/ChatPanel.test.tsx",
    "apps/web/src/features/chat/ChatPanel.tsx",
    "apps/web/src/features/chat/CitationDrawer.test.tsx",
    "apps/web/src/features/chat/CitationDrawer.tsx",
    "apps/web/src/features/chat/ClaimEvidence.tsx",
    "apps/web/src/features/documents/DocumentRequestForm.test.tsx",
    "apps/web/src/features/documents/DocumentRequestForm.tsx",
    "apps/web/src/features/handover/HandoverPanel.test.tsx",
    "apps/web/src/features/handover/HandoverPanel.tsx",
    "apps/web/src/features/knowledge/KnowledgeReview.test.tsx",
    "apps/web/src/features/knowledge/KnowledgeReview.tsx",
    "apps/web/src/features/operations/CapabilityBanner.test.tsx",
    "apps/web/src/features/operations/CapabilityBanner.tsx",
    "apps/web/src/features/privacy/PrivacyCenter.test.tsx",
    "apps/web/src/features/privacy/PrivacyCenter.tsx",
    "apps/web/src/features/rooms/RoomBooking.test.tsx",
    "apps/web/src/features/rooms/RoomBooking.tsx",
    "apps/web/src/features/staff/StaffTicketQueue.test.tsx",
    "apps/web/src/features/staff/StaffTicketQueue.tsx",
    "apps/web/src/features/tickets/TicketList.test.tsx",
    "apps/web/src/features/tickets/TicketList.tsx",
    "apps/web/src/styles/tokens.css",
    "apps/web/tsconfig.tsbuildinfo",
    "docs/10-delivery/AUDIT_REMEDIATION_STATUS_2026-09-27.md",
    "services/api/src/campus247/agent/grounding/evidence_gate.py",
    "services/api/src/campus247/agent/state.py",
    "services/api/src/campus247/bootstrap/app.py",
    "services/api/src/campus247/infrastructure/repositories/composition.py",
    "services/api/src/campus247/presentation/identity.py",
    "services/api/src/campus247/presentation/rooms.py",
    "services/api/src/campus247/presentation/ticket_queries.py",
    "tasks/dag.yaml",
    "tasks/items/TASK-AGENT-EVIDENCE-002-output.json",
    "tasks/items/TASK-DB-REPOFIX-001-output.json",
    "tasks/items/TASK-GOV-AUD-001-output.json",
    "tasks/items/TASK-GOV-AUD-002-output.json",
    "tasks/items/TASK-GOV-AUD-003-output.json",
    "tasks/items/TASK-TEST-WEB-002.yaml",
    "tasks/items/TASK-WEB-AUTH-002.yaml",
    "tasks/items/TASK-WEB-CHAT-003.yaml",
    "tasks/items/TASK-WEB-CITE-002.yaml",
    "tasks/items/TASK-WEB-CITE-003-output.json",
    "tasks/items/TASK-WEB-CITE-003.yaml",
    "tasks/items/TASK-WEB-DOCREQ-002.yaml",
    "tasks/items/TASK-WEB-HOME-002.yaml",
    "tasks/items/TASK-WEB-KNOW-002.yaml",
    "tasks/items/TASK-WEB-OPS-002.yaml",
    "tasks/items/TASK-WEB-PRIV-002.yaml",
    "tasks/items/TASK-WEB-ROOM-002.yaml",
    "tasks/items/TASK-WEB-ROOM-003.yaml",
    "tasks/items/TASK-WEB-SAFE-001.yaml",
    "tasks/items/TASK-WEB-SCHED-002.yaml",
    "tasks/items/TASK-WEB-SCHED-003.yaml",
    "tasks/items/TASK-WEB-STAFF-002.yaml",
    "tasks/items/TASK-WEB-TICK-002.yaml",
    "tasks/items/TASK-WEB-TICK-003.yaml",
    "tasks/requirement-acceptance-bindings.yaml",
    "tasks/task-index.yaml",
    "tasks/tools/validate_catalog.py",
    "tests/delivery/test_audit_remediation_ledger.py",
    "tests/delivery/test_task_catalog.py",
    "tests/unit/agent/test_evidence_gate.py"
  ],
  "resolved_upstream_traceability": {
    "resolution_mode": "canonical",
    "binding_ref": "tasks/requirement-acceptance-bindings.yaml",
    "requirements": [
      {
        "requirement_id": "REQ-F-SCHEDULE-002",
        "acceptance_criteria": ["AC-REQ-F-SCHEDULE-002-01"]
      }
    ]
  },
  "commands": [
    {
      "command": "npm --prefix apps/web test -- --run src/features/schedule/ScheduleView.test.tsx",
      "working_directory": "c:\\Users\\Duong Vinh\\Vinh",
      "exit_code": 0,
      "result": "passed",
      "evidence_refs": ["test-web-sched-output"]
    },
    {
      "command": "python -B tasks/tools/validate_catalog.py",
      "working_directory": "c:\\Users\\Duong Vinh\\Vinh",
      "exit_code": 0,
      "result": "passed",
      "evidence_refs": ["catalog-validation-output"]
    }
  ],
  "acceptance_results": [
    {
      "criterion_id": "AC-TASK-WEB-SCHED-004-01",
      "status": "passed",
      "evidence_refs": ["test-web-sched-output", "catalog-validation-output"]
    },
    {
      "criterion_id": "AC-TASK-WEB-SCHED-004-02",
      "status": "passed",
      "evidence_refs": ["test-web-sched-output", "catalog-validation-output"]
    },
    {
      "criterion_id": "AC-TASK-WEB-SCHED-004-03",
      "status": "passed",
      "evidence_refs": ["test-web-sched-output", "catalog-validation-output"]
    },
    {
      "criterion_id": "AC-TASK-WEB-SCHED-004-99",
      "status": "passed",
      "evidence_refs": ["test-web-sched-output", "catalog-validation-output"]
    }
  ],
  "evidence": [
    {
      "kind": "test_output",
      "ref": "test-web-sched-output",
      "sha256": null
    },
    {
      "kind": "validator_output",
      "ref": "catalog-validation-output",
      "sha256": null
    },
    {
      "kind": "file_hash",
      "ref": "apps/web/src/features/schedule/ScheduleView.tsx",
      "sha256": "aa9200966e2dd54363b7f4a799af9e69bf75dc0a30d997ae237272a9bb0459a0"
    },
    {
      "kind": "file_hash",
      "ref": "apps/web/src/features/schedule/ScheduleView.test.tsx",
      "sha256": "e3fc5cb448e325aef448f1337a449516f280a3779a42d3e451c815469394c2db"
    },
    {
      "kind": "file_hash",
      "ref": "apps/web/src/app/schedule/page.tsx",
      "sha256": "95adca056f68877105aef9a46a01e7c2e67dadfd61f002a1eda509ae4f2b2ad5"
    }
  ],
  "diff_summary": "Passed isStale and isDegraded props to ScheduleView to render explicit degraded visual states. Hardcoded timezone 'Asia/Ho_Chi_Minh' in all toLocaleTimeString and toLocaleDateString calls to ensure timestamps remain authoritative and ignore browser locale/timezone shifts. Added corresponding unit tests in ScheduleView.",
  "scope_conformance": {
    "status": "passed",
    "unexpected_files": []
  },
  "deviations": [],
  "residual_risks": [],
  "blocker": null
}
