{
  "schema_version": "1.0",
  "task_id": "TASK-WEB-STATE-002",
  "result": "completed",
  "source_revision": "HEAD",
  "started_at": "2026-09-26T16:10:00Z",
  "completed_at": "2026-09-26T16:14:00Z",
  "changed_files": [
    "apps/web/src/components/AsyncState.tsx",
    "apps/web/src/components/AsyncState.test.tsx"
  ],
  "preexisting_changes": [],
  "resolved_upstream_traceability": {
    "resolution_mode": "direct",
    "binding_ref": "tasks/requirement-acceptance-bindings.yaml",
    "requirements": [
      {
        "requirement_id": "REQ-NF-A11Y-003",
        "acceptance_criteria": ["AC-REQ-NF-A11Y-003-01"]
      }
    ]
  },
  "commands": [
    {
      "command": "corepack pnpm --dir apps/web test --run src/components/AsyncState.test.tsx",
      "working_directory": "c:/Users/Duong Vinh/Vinh",
      "exit_code": 0,
      "result": "passed",
      "evidence_refs": []
    }
  ],
  "acceptance_results": [
    {
      "criterion_id": "AC-TASK-WEB-STATE-002-01",
      "status": "passed",
      "evidence_refs": []
    },
    {
      "criterion_id": "AC-TASK-WEB-STATE-002-02",
      "status": "passed",
      "evidence_refs": []
    },
    {
      "criterion_id": "AC-TASK-WEB-STATE-002-03",
      "status": "passed",
      "evidence_refs": []
    },
    {
      "criterion_id": "AC-TASK-WEB-STATE-002-04",
      "status": "passed",
      "evidence_refs": []
    }
  ],
  "evidence": [],
  "diff_summary": "Added support for zero-result, stale, degraded, unauthorized, and result-unknown states in AsyncState.",
  "scope_conformance": {
    "status": "passed",
    "unexpected_files": []
  },
  "deviations": [],
  "residual_risks": [],
  "blocker": null
}