{
  "schema_version": "1.0",
  "task_id": "TASK-WEB-HOME-002",
  "result": "completed",
  "source_revision": "HEAD",
  "started_at": "2026-09-26T16:58:00Z",
  "completed_at": "2026-09-26T17:06:00Z",
  "changed_files": [
    "apps/web/src/app/page.tsx",
    "apps/web/src/app/page.test.tsx"
  ],
  "preexisting_changes": [
    "apps/web/e2e/handover.spec.ts",
    "apps/web/src/app/chat/page.tsx",
    "apps/web/src/app/chat/page.test.tsx",
    "apps/web/src/features/handover/HandoverPanel.test.tsx",
    "apps/web/src/features/handover/HandoverPanel.tsx",
    "diff.txt",
    "tasks/items/TASK-WEB-AUTH-002.yaml",
    "tasks/items/TASK-WEB-AUTH-002-output.json",
    "tasks/items/TASK-WEB-SAFE-001.yaml",
    "tasks/items/TASK-WEB-SAFE-001-output.json"
  ],
  "resolved_upstream_traceability": {
    "resolution_mode": "direct",
    "binding_ref": "tasks/requirement-acceptance-bindings.yaml",
    "requirements": [
      {
        "requirement_id": "REQ-F-GOV-001",
        "acceptance_criteria": [
          "AC-REQ-F-GOV-001-01"
        ]
      }
    ]
  },
  "commands": [
    {
      "command": "corepack pnpm --dir apps/web test --run src/app/page.test.tsx",
      "working_directory": "c:/Users/Duong Vinh/Vinh",
      "exit_code": 0,
      "result": "passed",
      "evidence_refs": []
    },
    {
      "command": "corepack pnpm --dir apps/web lint",
      "working_directory": "c:/Users/Duong Vinh/Vinh",
      "exit_code": 0,
      "result": "passed",
      "evidence_refs": []
    }
  ],
  "acceptance_results": [
    {
      "criterion_id": "AC-TASK-WEB-HOME-002-01",
      "status": "passed",
      "evidence_refs": []
    },
    {
      "criterion_id": "AC-TASK-WEB-HOME-002-02",
      "status": "passed",
      "evidence_refs": []
    },
    {
      "criterion_id": "AC-TASK-WEB-HOME-002-03",
      "status": "passed",
      "evidence_refs": []
    },
    {
      "criterion_id": "AC-TASK-WEB-HOME-002-04",
      "status": "passed",
      "evidence_refs": []
    }
  ],
  "evidence": [],
  "diff_summary": "Rebuilt student dashboard around academic priorities without decorative 4-card feature grid, placing next schedule and open requests first, with fast search bar and scannable task chips.",
  "scope_conformance": {
    "status": "passed",
    "unexpected_files": []
  },
  "deviations": [],
  "residual_risks": [],
  "blocker": null
}
