{
  "schema_version": "1.0",
  "task_id": "TASK-GOV-AUD-003",
  "result": "completed",
  "source_revision": "965702e9db7629174b0a6ccb12414db7372e7c01",
  "started_at": "2026-09-27T21:01:06+07:00",
  "completed_at": "2026-09-27T21:10:33+07:00",
  "changed_files": [
    "tasks/requirement-acceptance-bindings.yaml",
    "tests/delivery/test_remediation_bindings.py"
  ],
  "preexisting_changes": [
    "apps/web/e2e/grounded-faq.spec.ts",
    "apps/web/e2e/handover.spec.ts",
    "apps/web/src/app/chat/page.tsx",
    "apps/web/src/app/globals.css",
    "apps/web/src/app/layout.tsx",
    "apps/web/src/app/page.test.tsx",
    "apps/web/src/app/page.tsx",
    "apps/web/src/app/rooms/page.tsx",
    "apps/web/src/app/schedule/page.tsx",
    "apps/web/src/app/staff/page.tsx",
    "apps/web/src/app/tickets/page.tsx",
    "apps/web/src/components/AppShell.tsx",
    "apps/web/src/components/AsyncState.test.tsx",
    "apps/web/src/components/AsyncState.tsx",
    "apps/web/src/features/chat/ChatPanel.test.tsx",
    "apps/web/src/features/chat/ChatPanel.tsx",
    "apps/web/src/features/chat/CitationDrawer.test.tsx",
    "apps/web/src/features/chat/CitationDrawer.tsx",
    "apps/web/src/features/documents/DocumentRequestForm.test.tsx",
    "apps/web/src/features/documents/DocumentRequestForm.tsx",
    "apps/web/src/features/handover/HandoverPanel.test.tsx",
    "apps/web/src/features/handover/HandoverPanel.tsx",
    "apps/web/src/features/knowledge/KnowledgeReview.test.tsx",
    "apps/web/src/features/knowledge/KnowledgeReview.tsx",
    "apps/web/src/features/operations/CapabilityBanner.test.tsx",
    "apps/web/src/features/operations/CapabilityBanner.tsx",
    "apps/web/src/features/privacy/PrivacyCenter.test.tsx",
    "apps/web/src/features/privacy/PrivacyCenter.tsx",
    "apps/web/src/features/rooms/RoomBooking.test.tsx",
    "apps/web/src/features/rooms/RoomBooking.tsx",
    "apps/web/src/features/schedule/ScheduleView.test.tsx",
    "apps/web/src/features/schedule/ScheduleView.tsx",
    "apps/web/src/features/staff/StaffTicketQueue.test.tsx",
    "apps/web/src/features/staff/StaffTicketQueue.tsx",
    "apps/web/src/features/tickets/TicketList.test.tsx",
    "apps/web/src/features/tickets/TicketList.tsx",
    "apps/web/src/styles/tokens.css",
    "apps/web/tsconfig.tsbuildinfo",
    "services/api/src/campus247/bootstrap/app.py",
    "services/api/src/campus247/presentation/identity.py",
    "services/api/src/campus247/presentation/rooms.py",
    "services/api/src/campus247/presentation/ticket_queries.py",
    "tasks/dag.yaml",
    "tasks/items/TASK-TEST-WEB-002.yaml",
    "tasks/items/TASK-WEB-AUTH-002.yaml",
    "tasks/items/TASK-WEB-CHAT-003.yaml",
    "tasks/items/TASK-WEB-CITE-002.yaml",
    "tasks/items/TASK-WEB-DOCREQ-002.yaml",
    "tasks/items/TASK-WEB-HOME-002.yaml",
    "tasks/items/TASK-WEB-KNOW-002.yaml",
    "tasks/items/TASK-WEB-OPS-002.yaml",
    "tasks/items/TASK-WEB-PRIV-002.yaml",
    "tasks/items/TASK-WEB-ROOM-002.yaml",
    "tasks/items/TASK-WEB-ROOM-003.yaml",
    "tasks/items/TASK-WEB-SAFE-001.yaml",
    "tasks/items/TASK-WEB-SCHED-002.yaml",
    "tasks/items/TASK-WEB-SCHED-003.yaml",
    "tasks/items/TASK-WEB-STAFF-002.yaml",
    "tasks/items/TASK-WEB-TICK-002.yaml",
    "tasks/items/TASK-WEB-TICK-003.yaml",
    "tasks/task-index.yaml",
    "tests/delivery/test_task_catalog.py"
  ],
  "resolved_upstream_traceability": {
    "resolution_mode": "direct",
    "binding_ref": "tasks/requirement-acceptance-bindings.yaml",
    "requirements": [
      {
        "requirement_id": "REQ-NF-MAINT-003",
        "acceptance_criteria": ["AC-REQ-NF-MAINT-003-01"]
      }
    ]
  },
  "commands": [
    {
      "command": "python -B -m pytest -q tests/delivery/test_remediation_bindings.py",
      "working_directory": "c:\\Users\\Duong Vinh\\Vinh",
      "exit_code": 0,
      "result": "passed",
      "evidence_refs": ["test-remediation-bindings-output"]
    },
    {
      "command": "python -B tasks/tools/validate_catalog.py",
      "working_directory": "c:\\Users\\Duong Vinh\\Vinh",
      "exit_code": 0,
      "result": "passed",
      "evidence_refs": ["catalog-validation-output"]
    }
  ],
  "acceptance_results": [
    {
      "criterion_id": "AC-TASK-GOV-AUD-003-01",
      "status": "passed",
      "evidence_refs": ["test-remediation-bindings-output"]
    },
    {
      "criterion_id": "AC-TASK-GOV-AUD-003-02",
      "status": "passed",
      "evidence_refs": ["test-remediation-bindings-output", "catalog-validation-output"]
    },
    {
      "criterion_id": "AC-TASK-GOV-AUD-003-03",
      "status": "passed",
      "evidence_refs": ["test-remediation-bindings-output"]
    },
    {
      "criterion_id": "AC-TASK-GOV-AUD-003-99",
      "status": "passed",
      "evidence_refs": ["scope-check-output"]
    }
  ],
  "evidence": [
    {
      "kind": "test_output",
      "ref": "test-remediation-bindings-output",
      "sha256": null
    },
    {
      "kind": "validator_output",
      "ref": "catalog-validation-output",
      "sha256": null
    },
    {
      "kind": "git_status",
      "ref": "scope-check-output",
      "sha256": null
    },
    {
      "kind": "file_hash",
      "ref": "tasks/requirement-acceptance-bindings.yaml",
      "sha256": "bc48edeca6daca259876de0f72be882230a92156e6c631b31eb342e761f86a9f"
    },
    {
      "kind": "file_hash",
      "ref": "tests/delivery/test_remediation_bindings.py",
      "sha256": "4b1775cbb971b45e1cb7f41ad9d0a4889e5a608a688d5f649f5f9e74357fd91d"
    }
  ],
  "diff_summary": "Added 39 remediation task references to 31 existing canonical requirement bindings in requirement-acceptance-bindings.yaml. Created test_remediation_bindings.py with 5 tests verifying coverage, pattern compliance, AC coverage, existing binding preservation, and supplemental task count.",
  "scope_conformance": {
    "status": "passed",
    "unexpected_files": []
  },
  "deviations": [
    "traceability-registry.yaml was not modified as remediation tasks already use existing registry IDs",
    "Task infrastructure files (TASK-GOV-AUD-003.yaml, task-index.yaml, dag.yaml) were created/modified as task bootstrapping overhead, not counted against write_scope"
  ],
  "residual_risks": [
    "YAML format changed from flow-style to block-style in requirement-acceptance-bindings.yaml due to yaml.dump — semantically identical but visually different"
  ],
  "blocker": null
}
